{
  "$schema": "http://json-schema.org/draft-07/schema#",
  "title": "Langfens Roleplay Scenario",
  "description": "Schema for a roleplay scenario. Save to ai-service/app/data/scenarios/. One file per scenario.",
  "type": "object",
  "required": ["id", "slug", "title", "difficulty", "ielts_part", "context", "user_role", "agent_role", "opening_prompt", "target_vocabulary", "duration_min"],
  "properties": {
    "id": {
      "type": "string",
      "format": "uuid",
      "description": "Unique UUID.",
      "example": "b1c2d3e4-f5a6-7890-bcde-f12345678901"
    },
    "slug": {
      "type": "string",
      "pattern": "^[a-z0-9-]+$",
      "description": "kebab-case unique identifier. Used in URLs and filenames.",
      "example": "job-interview-tech"
    },
    "title": {
      "type": "string",
      "minLength": 5,
      "maxLength": 80,
      "description": "Display name for learners.",
      "example": "Job Interview: Tech Company"
    },
    "difficulty": {
      "type": "string",
      "enum": ["BEGINNER", "INTERMEDIATE", "ADVANCED"],
      "description": "Difficulty based on vocabulary and grammar complexity."
    },
    "ielts_part": {
      "type": "string",
      "enum": ["PART_1", "PART_2", "PART_3", "SITUATIONAL"],
      "description": "PART_1=personal questions, PART_2=cue card, PART_3=abstract discussion, SITUATIONAL=real-life scenario."
    },
    "context": {
      "type": "string",
      "minLength": 20,
      "maxLength": 500,
      "description": "Situation description. 2-4 sentences. Student reads before starting.",
      "example": "You are attending a job interview at a technology company in Singapore. The interviewer will ask about your background, skills, and motivation. Try to use professional language and specific examples."
    },
    "user_role": {
      "type": "string",
      "minLength": 5,
      "maxLength": 150,
      "description": "Description of the student's role.",
      "example": "A recent graduate applying for a software developer position"
    },
    "agent_role": {
      "type": "string",
      "minLength": 5,
      "maxLength": 150,
      "description": "Role of the AI agent.",
      "example": "HR manager at a tech company conducting a job interview"
    },
    "opening_prompt": {
      "type": "string",
      "minLength": 10,
      "maxLength": 300,
      "description": "Agent's opening line. This is the first turn in the conversation.",
      "example": "Good morning! Please have a seat. I'm Sarah from HR. Before we begin, could you briefly introduce yourself and tell me why you're interested in this position?"
    },
    "target_vocabulary": {
      "type": "array",
      "minItems": 5,
      "maxItems": 20,
      "description": "Words/phrases the agent encourages the student to use. Agent tracks usage in session.",
      "items": {
        "type": "string"
      },
      "example": ["motivated", "collaborative", "proficient in", "experience with", "contribute to", "team player", "deadline-driven"]
    },
    "target_grammar": {
      "type": "array",
      "items": {"type": "string"},
      "description": "Grammar structures to practice in this scenario.",
      "example": ["Present Perfect for experience", "Passive Voice for achievements", "Conditional for hypotheticals"]
    },
    "suggested_topics": {
      "type": "array",
      "items": {"type": "string"},
      "description": "Topics the agent may ask about in the conversation.",
      "example": ["education background", "work experience", "teamwork examples", "career goals", "salary expectations"]
    },
    "duration_min": {
      "type": "integer",
      "minimum": 3,
      "maximum": 15,
      "description": "Expected duration (minutes) for a full session."
    },
    "turn_count_target": {
      "type": "integer",
      "minimum": 3,
      "maximum": 20,
      "description": "Expected number of turns (exchanges) in a session.",
      "default": 8
    }
  },
  "additionalProperties": false,

  "_examples": {
    "description": "Complete scenario example (NOT a real field):",
    "sample": {
      "id": "b1c2d3e4-f5a6-7890-bcde-f12345678901",
      "slug": "job-interview-tech",
      "title": "Job Interview: Technology Company",
      "difficulty": "INTERMEDIATE",
      "ielts_part": "SITUATIONAL",
      "context": "You are attending a job interview at a technology company in Singapore. The interviewer will ask about your background, technical skills, and motivation. Use professional language and specific examples from your experience.",
      "user_role": "A computer science graduate applying for a junior software developer position",
      "agent_role": "HR manager at a mid-sized tech company conducting a first-round interview",
      "opening_prompt": "Good morning! Please have a seat. I'm Sarah from HR. Let's start — could you briefly introduce yourself and tell me what attracted you to this role?",
      "target_vocabulary": ["motivated", "collaborative", "proficient in", "experienced with", "contribute to", "deadline-oriented", "cross-functional", "scalable", "innovative"],
      "target_grammar": ["Present Perfect for experience", "Specific examples with Past Simple", "Conditional sentences for problem-solving"],
      "suggested_topics": ["educational background", "technical skills", "teamwork experience", "biggest challenge", "career goals"],
      "duration_min": 8,
      "turn_count_target": 10
    }
  }
}
