{
  "id": "REPLACE_WITH_UUID4",
  "slug": "REPLACE-with-kebab-case-slug",
  "title": "REPLACE: e.g. 'Job Interview: Tech Company'",
  "difficulty": "INTERMEDIATE",
  "ielts_part": "PART_2",
  "context": "REPLACE: 2-4 sentences describing the situation. Student reads this before starting.",
  "user_role": "REPLACE: e.g. 'A student describing a recent travel experience'",
  "agent_role": "REPLACE: e.g. 'IELTS examiner for Speaking Part 2'",
  "opening_prompt": "REPLACE: Agent's first message to student. Natural, in-character, 1-3 sentences.",
  "target_vocabulary": [
    "word1",
    "word2",
    "phrase three",
    "word4",
    "word5"
  ],
  "target_grammar": [
    "Past Simple for narrating",
    "Descriptive adjectives"
  ],
  "suggested_topics": [
    "topic1",
    "topic2",
    "topic3"
  ],
  "duration_min": 5,
  "turn_count_target": 8
}
